{
  "schema": "run_report@v0",
  "run_id": "dc6c08ff",
  "step_id": "manual",
  "agent": "manual_testing",
  "status": "COMPLETED",
  "started_at": "2025-09-30T20:56:10Z",
  "ended_at": "2025-09-30T20:56:11Z",
  "artifacts": [
    "/Users/chriscullins/src/agent_orchestrator/sdlc_agents_poc/demo_repo/.agents/artifacts/dc6c08ff__manual/artifact.txt"
  ],
  "metrics": {
    "tokens_in": 0,
    "tokens_out": 0,
    "duration_ms": 0
  },
  "logs": [
    "Simulated agent run completed."
  ],
  "next_suggested_steps": []
}